{
  "note": "Codes and publicly known module titles only. Verbatim 课标 text is not included.",
  "codesOnlySources": [
    "moe-df-2022",
    "moe-dl-2017",
    "moe-dl-2022",
    "moe-hx-2017",
    "moe-kx-2022",
    "moe-ld-2020",
    "moe-ld-2022",
    "moe-ls-2017",
    "moe-ls-2022",
    "moe-sw-2017",
    "moe-sx-2017",
    "moe-sx-2022",
    "moe-ty-2017",
    "moe-ty-2022",
    "moe-wl-2017",
    "moe-xxkj-2022",
    "moe-ys-2017",
    "moe-ys-2022",
    "moe-yw-2017",
    "moe-yw-2022",
    "moe-yy-2017",
    "moe-yy-2022",
    "moe-zz-2017"
  ],
  "curriculumCount": 23,
  "curricula": [
    {
      "slug": "moe-df-2022",
      "country": "CN",
      "name": "义务教育道德与法治课程标准（2022年版）",
      "version": "2022",
      "sourceUrl": "https://www.moe.gov.cn/srcsite/A26/s8001/202204/t20220420_619921.html",
      "textIncluded": false,
      "license": "© 中华人民共和国教育部. Codes and publicly known theme titles only; verbatim 课标 text omitted.",
      "topics": [
        {
          "key": "moe-df-2022:SELF",
          "code": "SELF"
        },
        {
          "key": "moe-df-2022:SOC",
          "code": "SOC"
        },
        {
          "key": "moe-df-2022:LAW",
          "code": "LAW"
        },
        {
          "key": "moe-df-2022:NAT",
          "code": "NAT"
        },
        {
          "key": "moe-df-2022:SELF.S1",
          "code": "SELF.S1"
        },
        {
          "key": "moe-df-2022:SOC.S1",
          "code": "SOC.S1"
        },
        {
          "key": "moe-df-2022:LAW.S1",
          "code": "LAW.S1"
        },
        {
          "key": "moe-df-2022:NAT.S1",
          "code": "NAT.S1"
        },
        {
          "key": "moe-df-2022:SELF.S2",
          "code": "SELF.S2"
        },
        {
          "key": "moe-df-2022:SOC.S2",
          "code": "SOC.S2"
        },
        {
          "key": "moe-df-2022:LAW.S2",
          "code": "LAW.S2"
        },
        {
          "key": "moe-df-2022:NAT.S2",
          "code": "NAT.S2"
        },
        {
          "key": "moe-df-2022:SELF.S3",
          "code": "SELF.S3"
        },
        {
          "key": "moe-df-2022:SOC.S3",
          "code": "SOC.S3"
        },
        {
          "key": "moe-df-2022:LAW.S3",
          "code": "LAW.S3"
        },
        {
          "key": "moe-df-2022:NAT.S3",
          "code": "NAT.S3"
        },
        {
          "key": "moe-df-2022:SELF.S4",
          "code": "SELF.S4"
        },
        {
          "key": "moe-df-2022:SOC.S4",
          "code": "SOC.S4"
        },
        {
          "key": "moe-df-2022:LAW.S4",
          "code": "LAW.S4"
        },
        {
          "key": "moe-df-2022:NAT.S4",
          "code": "NAT.S4"
        }
      ],
      "topicCount": 20
    },
    {
      "slug": "moe-dl-2017",
      "country": "CN",
      "name": "普通高中地理课程标准（2017年版2020年修订）",
      "version": "2017/2020",
      "sourceUrl": "https://www.moe.gov.cn/srcsite/A26/s8001/202006/t20200603_462199.html",
      "textIncluded": false,
      "license": "© 中华人民共和国教育部. Codes and publicly known module titles only; verbatim 课标 text omitted.",
      "topics": [
        {
          "key": "moe-dl-2017:G1",
          "code": "G1"
        },
        {
          "key": "moe-dl-2017:G2",
          "code": "G2"
        },
        {
          "key": "moe-dl-2017:S1",
          "code": "S1"
        },
        {
          "key": "moe-dl-2017:S2",
          "code": "S2"
        },
        {
          "key": "moe-dl-2017:S3",
          "code": "S3"
        }
      ],
      "topicCount": 5
    },
    {
      "slug": "moe-dl-2022",
      "country": "CN",
      "name": "义务教育地理课程标准（2022年版）",
      "version": "2022",
      "sourceUrl": "https://www.moe.gov.cn/srcsite/A26/s8001/202204/t20220420_619921.html",
      "textIncluded": false,
      "license": "© 中华人民共和国教育部. Codes and publicly known module titles only; verbatim 课标 text omitted.",
      "topics": [
        {
          "key": "moe-dl-2022:EM",
          "code": "EM"
        },
        {
          "key": "moe-dl-2022:WG",
          "code": "WG"
        },
        {
          "key": "moe-dl-2022:CG",
          "code": "CG"
        },
        {
          "key": "moe-dl-2022:LG",
          "code": "LG"
        }
      ],
      "topicCount": 4
    },
    {
      "slug": "moe-hx-2017",
      "country": "CN",
      "name": "普通高中化学课程标准（2017年版2020年修订）",
      "version": "2017/2020",
      "sourceUrl": "https://www.moe.gov.cn/srcsite/A26/s8001/202006/t20200603_462199.html",
      "textIncluded": false,
      "license": "© 中华人民共和国教育部. Codes and publicly known theme titles only; verbatim 课标 text omitted.",
      "topics": [
        {
          "key": "moe-hx-2017:MAT",
          "code": "MAT"
        },
        {
          "key": "moe-hx-2017:RXN",
          "code": "RXN"
        },
        {
          "key": "moe-hx-2017:STR",
          "code": "STR"
        },
        {
          "key": "moe-hx-2017:ORG",
          "code": "ORG"
        },
        {
          "key": "moe-hx-2017:LAB",
          "code": "LAB"
        }
      ],
      "topicCount": 5
    },
    {
      "slug": "moe-kx-2022",
      "country": "CN",
      "name": "义务教育科学课程标准（2022年版）",
      "version": "2022",
      "sourceUrl": "https://www.moe.gov.cn/srcsite/A26/s8001/202204/t20220420_619921.html",
      "textIncluded": false,
      "license": "© 中华人民共和国教育部. Codes and publicly named 13 core concepts / 4 fields only; verbatim 课标 text omitted.",
      "topics": [
        {
          "key": "moe-kx-2022:MS",
          "code": "MS"
        },
        {
          "key": "moe-kx-2022:LS",
          "code": "LS"
        },
        {
          "key": "moe-kx-2022:ES",
          "code": "ES"
        },
        {
          "key": "moe-kx-2022:TE",
          "code": "TE"
        },
        {
          "key": "moe-kx-2022:C01",
          "code": "C01"
        },
        {
          "key": "moe-kx-2022:C02",
          "code": "C02"
        },
        {
          "key": "moe-kx-2022:C03",
          "code": "C03"
        },
        {
          "key": "moe-kx-2022:C04",
          "code": "C04"
        },
        {
          "key": "moe-kx-2022:C05",
          "code": "C05"
        },
        {
          "key": "moe-kx-2022:C06",
          "code": "C06"
        },
        {
          "key": "moe-kx-2022:C07",
          "code": "C07"
        },
        {
          "key": "moe-kx-2022:C08",
          "code": "C08"
        },
        {
          "key": "moe-kx-2022:C09",
          "code": "C09"
        },
        {
          "key": "moe-kx-2022:C10",
          "code": "C10"
        },
        {
          "key": "moe-kx-2022:C11",
          "code": "C11"
        },
        {
          "key": "moe-kx-2022:C12",
          "code": "C12"
        },
        {
          "key": "moe-kx-2022:C13",
          "code": "C13"
        },
        {
          "key": "moe-kx-2022:C01.S1",
          "code": "C01.S1"
        },
        {
          "key": "moe-kx-2022:C02.S1",
          "code": "C02.S1"
        },
        {
          "key": "moe-kx-2022:C03.S1",
          "code": "C03.S1"
        },
        {
          "key": "moe-kx-2022:C04.S1",
          "code": "C04.S1"
        },
        {
          "key": "moe-kx-2022:C05.S1",
          "code": "C05.S1"
        },
        {
          "key": "moe-kx-2022:C07.S1",
          "code": "C07.S1"
        },
        {
          "key": "moe-kx-2022:C08.S1",
          "code": "C08.S1"
        },
        {
          "key": "moe-kx-2022:C09.S1",
          "code": "C09.S1"
        },
        {
          "key": "moe-kx-2022:C10.S1",
          "code": "C10.S1"
        },
        {
          "key": "moe-kx-2022:C11.S1",
          "code": "C11.S1"
        },
        {
          "key": "moe-kx-2022:C12.S1",
          "code": "C12.S1"
        },
        {
          "key": "moe-kx-2022:C13.S1",
          "code": "C13.S1"
        },
        {
          "key": "moe-kx-2022:C01.S2",
          "code": "C01.S2"
        },
        {
          "key": "moe-kx-2022:C02.S2",
          "code": "C02.S2"
        },
        {
          "key": "moe-kx-2022:C03.S2",
          "code": "C03.S2"
        },
        {
          "key": "moe-kx-2022:C04.S2",
          "code": "C04.S2"
        },
        {
          "key": "moe-kx-2022:C05.S2",
          "code": "C05.S2"
        },
        {
          "key": "moe-kx-2022:C06.S2",
          "code": "C06.S2"
        },
        {
          "key": "moe-kx-2022:C07.S2",
          "code": "C07.S2"
        },
        {
          "key": "moe-kx-2022:C08.S2",
          "code": "C08.S2"
        },
        {
          "key": "moe-kx-2022:C09.S2",
          "code": "C09.S2"
        },
        {
          "key": "moe-kx-2022:C10.S2",
          "code": "C10.S2"
        },
        {
          "key": "moe-kx-2022:C11.S2",
          "code": "C11.S2"
        },
        {
          "key": "moe-kx-2022:C12.S2",
          "code": "C12.S2"
        },
        {
          "key": "moe-kx-2022:C13.S2",
          "code": "C13.S2"
        },
        {
          "key": "moe-kx-2022:C01.S3",
          "code": "C01.S3"
        },
        {
          "key": "moe-kx-2022:C02.S3",
          "code": "C02.S3"
        },
        {
          "key": "moe-kx-2022:C03.S3",
          "code": "C03.S3"
        },
        {
          "key": "moe-kx-2022:C04.S3",
          "code": "C04.S3"
        },
        {
          "key": "moe-kx-2022:C05.S3",
          "code": "C05.S3"
        },
        {
          "key": "moe-kx-2022:C06.S3",
          "code": "C06.S3"
        },
        {
          "key": "moe-kx-2022:C07.S3",
          "code": "C07.S3"
        },
        {
          "key": "moe-kx-2022:C08.S3",
          "code": "C08.S3"
        },
        {
          "key": "moe-kx-2022:C09.S3",
          "code": "C09.S3"
        },
        {
          "key": "moe-kx-2022:C10.S3",
          "code": "C10.S3"
        },
        {
          "key": "moe-kx-2022:C11.S3",
          "code": "C11.S3"
        },
        {
          "key": "moe-kx-2022:C12.S3",